{
  "schemaVersion": 2,
  "firmware": "FM-1_912",
  "reviewedOn": "2026-10-10",
  "reviewedSources": {
    "editor/src/graph/types.ts": "d151a68c85539525df1abc869e07378c17c9c21a3dd5d265bc9b4fe7ce72536a",
    "editor/src/graph/nodeTypes.ts": "1f79be272daf828e69d5a2513edd9cf76ac17d3e1ace160611cc59ef11e6fc09",
    "editor/src/graph/subpatch.ts": "56fd60b9c664479761eefaa1e4d5264160156974687bc529aba01716ed2fbeb5",
    "editor/src/graph/spread.ts": "58bec3d980343612b1fc6e31059ab2926b50455f7a547129ffd24b071d81a0da",
    "editor/src/graph/expression.ts": "3d9ffced8af6611ed9b59414f2917895aa21fbf2d0f145d59eeab71a9ab34995",
    "editor/src/audio/dspProgram.ts": "7dc99dcea11d98893e94b12bac5785cb852c2a4ed2377f8d03de78c94a1e4ddc",
    "editor/src/audio/dspOpcodes.ts": "3e605442a356c87dd1c6aef58ce0d00d762c5ed31da0499b90e962181fed55ee",
    "editor/src/audio/fm1Package.ts": "63672634e1820228493997a7f20b4abc96778e12f0642fbd492c1d9e76045d22",
    "editor/src/audio/fm1Upload.ts": "352c53da3d8880cb83a0f3fb2f3f4d7c073de89ec007b1d5d55b7534658f0446",
    "editor/src/audio/fm1Support.ts": "dbb414526f456897f11548daf582d2201c58ef169aa48cc5140cc8dec1cb4c40",
    "editor/src/audio/fm1Capabilities.ts": "9dce2bb5869752fa79a06f37d5b2954a6cd28b23dd2486aee40ce35f69ccbb1b",
    "editor/src/editor/Fm1SupportPage.tsx": "4f634b0db59887bc62a1a8a0dbe811e563683ee4cfa534a3a4aa8a1760264f49",
    "editor/src/App.tsx": "a7ab18f0eea1c2c9e395d4c01b34d58621d483f7e9069b4325e82ff3a7da4eee",
    "editor/src/styles.css": "c3fc07b6de0507a4b086b6bcbdf47a474e612cf57ecf189d1ebf99d9dfcc4bc1",
    "firmware/fm1/runtime.h": "76a66566d92987d6f98521aa977208700c2a242bdcfb1c9ff6b6b73696b8135f",
    "firmware/fm1/app.c": "724c3fc22eebe3ff5f46b2377ef6743042599287107e074ce5fc5d30b499c714",
    "firmware/fm1/upload.h": "1c1c9452c85940a1f03337115a6b40b0727784481d241bcb6e2ddb8d89a1d776",
    "firmware/fm1/export-patch.mjs": "e168182cde8a0475276674e9bf9bf4845ba68c1976d10582ecba6a2de2b5747d",
    "scripts/fm1-runtime-spike.py": "ce457b030db05a6ac7833f942c9d8f921e40f73fd8be8eb84b0b73ce43f20f5c",
    "scripts/fm1-send-patch.py": "ac9f2d5aa2e845dd89660cecbe959f7f490a4bf2fa1aeb2b8f61e89428408c8d",
    "scripts/fm1-install.py": "cb0b4d51615e40b164fd767964d845a65f3931c194d698c650b724f9825f228c"
  },
  "features": [
    {
      "id": "Expression",
      "category": "node",
      "status": "partial",
      "since": 904,
      "verification": "source reviewed",
      "notes": "Basic arithmetic since 904; 907 adds abs/min/max/clamp/floor/ceil/round/sign/fract, comparisons and boolean logic. Q16.16 saturation; round ties away from zero. Transcendentals, pow, sqrt and mix remain unsupported.",
      "evidence": [
        "editor/src/audio/fm1Package.ts",
        "firmware/fm1/runtime.h",
        "firmware/fm1/README.md"
      ],
      "blockedInputs": [],
      "blockedOutputs": []
    },
    {
      "id": "Group",
      "category": "node",
      "status": "partial",
      "since": null,
      "verification": "source reviewed",
      "notes": "Structural routing is flattened by the graph compiler. Every enabled contained node must independently pass FM-1 eligibility; this is not a claim that arbitrary group contents are supported.",
      "evidence": [
        "editor/src/graph/subpatch.ts",
        "editor/src/audio/dspProgram.ts"
      ],
      "blockedInputs": [],
      "blockedOutputs": []
    },
    {
      "id": "Spread",
      "category": "node",
      "status": "unsupported",
      "since": null,
      "verification": "source reviewed",
      "notes": "No supported FM-1 lowering for this node operation or resource; browser support does not imply device support.",
      "evidence": [
        "editor/src/audio/fm1Package.ts",
        "editor/src/audio/dspProgram.ts"
      ],
      "blockedInputs": [],
      "blockedOutputs": []
    },
    {
      "id": "Spawn",
      "category": "node",
      "status": "unsupported",
      "since": null,
      "verification": "source reviewed",
      "notes": "No supported FM-1 lowering for this node operation or resource; browser support does not imply device support.",
      "evidence": [
        "editor/src/audio/fm1Package.ts",
        "editor/src/audio/dspProgram.ts"
      ],
      "blockedInputs": [],
      "blockedOutputs": []
    },
    {
      "id": "Ins",
      "category": "node",
      "status": "partial",
      "since": null,
      "verification": "source reviewed",
      "notes": "Structural routing is flattened by the graph compiler. Every enabled contained node must independently pass FM-1 eligibility; this is not a claim that arbitrary group contents are supported.",
      "evidence": [
        "editor/src/graph/subpatch.ts",
        "editor/src/audio/dspProgram.ts"
      ],
      "blockedInputs": [],
      "blockedOutputs": []
    },
    {
      "id": "Params",
      "category": "node",
      "status": "partial",
      "since": null,
      "verification": "source reviewed",
      "notes": "One enabled Params node may expose zero to six outputs. Their saved order maps directly to Knob 1, Knob 2, Knob 3, Knob 4, Select and Algorithm; each output supplies its screen label, default and range.",
      "evidence": [
        "editor/src/audio/fm1Package.ts",
        "firmware/fm1/runtime.h",
        "firmware/fm1/README.md"
      ],
      "blockedInputs": [],
      "blockedOutputs": []
    },
    {
      "id": "Outs",
      "category": "node",
      "status": "partial",
      "since": null,
      "verification": "source reviewed",
      "notes": "Structural routing is flattened by the graph compiler. Every enabled contained node must independently pass FM-1 eligibility; this is not a claim that arbitrary group contents are supported.",
      "evidence": [
        "editor/src/graph/subpatch.ts",
        "editor/src/audio/dspProgram.ts"
      ],
      "blockedInputs": [],
      "blockedOutputs": []
    },
    {
      "id": "AudioOut",
      "category": "node",
      "status": "supported",
      "since": null,
      "verification": "source reviewed",
      "notes": "Stereo output with device output bound and additional 6 dB headroom.",
      "evidence": [
        "editor/src/audio/fm1Package.ts",
        "firmware/fm1/runtime.h",
        "firmware/fm1/README.md"
      ],
      "blockedInputs": [],
      "blockedOutputs": []
    },
    {
      "id": "SineOsc",
      "category": "node",
      "status": "partial",
      "since": null,
      "verification": "source reviewed",
      "notes": "Audio-rate frequency/phase modulation, live range endpoints and rising-edge reset with an 8 ms crossfade; signal input remains unsupported and no waveform is band-limited.",
      "evidence": [
        "editor/src/audio/fm1Package.ts",
        "firmware/fm1/runtime.h",
        "firmware/fm1/README.md"
      ],
      "blockedInputs": [
        "signal"
      ],
      "blockedOutputs": []
    },
    {
      "id": "TriangleOsc",
      "category": "node",
      "status": "partial",
      "since": 904,
      "verification": "source reviewed",
      "notes": "Audio-rate frequency/phase modulation, live range endpoints and rising-edge reset with an 8 ms crossfade; signal input remains unsupported and no waveform is band-limited.",
      "evidence": [
        "editor/src/audio/fm1Package.ts",
        "firmware/fm1/runtime.h",
        "firmware/fm1/README.md"
      ],
      "blockedInputs": [
        "signal"
      ],
      "blockedOutputs": []
    },
    {
      "id": "SawOsc",
      "category": "node",
      "status": "partial",
      "since": 904,
      "verification": "source reviewed",
      "notes": "Audio-rate frequency/phase modulation, live range endpoints and rising-edge reset with an 8 ms crossfade; signal input remains unsupported and no waveform is band-limited.",
      "evidence": [
        "editor/src/audio/fm1Package.ts",
        "firmware/fm1/runtime.h",
        "firmware/fm1/README.md"
      ],
      "blockedInputs": [
        "signal"
      ],
      "blockedOutputs": []
    },
    {
      "id": "RampOsc",
      "category": "node",
      "status": "partial",
      "since": 904,
      "verification": "source reviewed",
      "notes": "Audio-rate frequency/phase modulation, live range endpoints and rising-edge reset with an 8 ms crossfade; signal input remains unsupported and no waveform is band-limited.",
      "evidence": [
        "editor/src/audio/fm1Package.ts",
        "firmware/fm1/runtime.h",
        "firmware/fm1/README.md"
      ],
      "blockedInputs": [
        "signal"
      ],
      "blockedOutputs": []
    },
    {
      "id": "SquareOsc",
      "category": "node",
      "status": "partial",
      "since": 904,
      "verification": "source reviewed",
      "notes": "Audio-rate frequency/phase modulation, live range endpoints and rising-edge reset with an 8 ms crossfade; live pulse width 0–1. Signal input remains unsupported and no waveform is band-limited.",
      "evidence": [
        "editor/src/audio/fm1Package.ts",
        "firmware/fm1/runtime.h",
        "firmware/fm1/README.md"
      ],
      "blockedInputs": [
        "signal"
      ],
      "blockedOutputs": []
    },
    {
      "id": "KinkOsc",
      "category": "node",
      "status": "partial",
      "since": 910,
      "verification": "source reviewed",
      "notes": "Live frequency, phase, reset, shape, squareness and range endpoints. Fixed-point power shaping is approximate and not band-limited.",
      "evidence": [
        "editor/src/audio/fm1Package.ts",
        "editor/src/audio/dspProgram.ts",
        "firmware/fm1/runtime.h"
      ],
      "blockedInputs": [],
      "blockedOutputs": []
    },
    {
      "id": "SampleHoldOsc",
      "category": "node",
      "status": "partial",
      "since": 910,
      "verification": "source reviewed",
      "notes": "Holds the signal on load and each rising trigger edge at 0.5; Q16.16 state resets on patch load.",
      "evidence": [
        "editor/src/audio/fm1Package.ts",
        "editor/src/audio/dspProgram.ts",